<messagerie xmlns:xsi="http://www.w3.org/2001/XMLSchema-instance" xsi:noNamespaceSchemaLocation="./silverprop1.xsd">
    <contacts>
        <contact id="1">
            <name>John</name>
            <telephone>788888888</telephone>
        </contact>
        <contact id="2">
            <name>Alice</name>
            <telephone>788888888</telephone>

        </contact>
        <contact id="3">
            <name>Bob</name>
            <telephone>788888888</telephone>
        </contact>
    </contacts>
    
<groups>
    <group id="1">
        <name>Family</name>
        <members>
            <member contactId="1" />
            <member contactId="2" />
        </members>
        <salons>
            <salon id="1">
                <name></name>
                <members>
                    <member contactId="1" />
                    <member contactId="2" />
                </members>

            </salon>
        </salons>
    </group>
    <group id="2">
        <name>Work</name>
        <members>
            <member contactId="2" />
            <member contactId="3" />
        </members>
    </group>
</groups>
<messages>
    <message id ="1" sender="1" recipient="2" timestamp="2023-06-27T10:15:00">
        <content type="text">
            <text>Alice! How are you?</text> 
        </content>
    </message>

    <message id ="2" sender="2" group="1" timestamp="2023-06-27T11:30:00">
        <content type="text">
            <text>I'm good</text>
        </content>
    </message>

    <message id ="3" sender="2" recipient="1" timestamp="2023-06-27T11:30:00">
        <content type="sondage">
        <text>sondage</text>
        <sondage>
            <question>
            what's your name?
            </question>
            <reponses>
                <choix>aly</choix>
                <choix>baba</choix>
            </reponses>
        </sondage>
        
        </content>
    </message>

    <message id ="4" sender="3" recipient="1" timestamp="2023-06-27T12:45:00">
        <content type="audio">
            <text>Maitre Gims- finito</text>
            <audio>audio_message.mp3</audio>
        </content>
    </message>

    <message id ="5" sender="1" group="2" timestamp="2023-06-27T14:00:00">
        <content type="file">
            <text>cours XML chap 1</text>
            <file>cOurschap1.pdf</file>
        </content>        
        <quote messageId="2" sender="2">I agree with Alice. Let's proceed.</quote>
    </message>
    <message id ="6" sender="1" group="2" timestamp="2023-06-27T14:00:00">
        <content type="link">
            <text>Facebook reseaux sociaux</text>
            <link>www.facebook.com</link>
        </content>
        <quote messageId="2" sender="2">site de test</quote>
    </message>

    <message id ="7" sender="3" recipient="1,2" timestamp="2023-06-27T10:35:00">
        <content type="text">
            <text>Hey John and Alice, I have an exciting news to share!</text>
        </content>
    </message>
    <message id ="8" sender="3" recipient="1,2" timestamp="2023-06-27T10:35:00">
        <content type="localisation" latitude="" longitude="">
            <text>j'habite ici</text>
            <localisation>ici</localisation>
        </content>
    </message>

    <message id ="9" sender="3" recipient="1,2" timestamp="2023-06-27T10:35:00">
        <content type="contact" >
            <text>Felix</text> 
            <contacte>Felix Ndao</contacte>
        </content>
    </message>
</messages>
    
</messagerie>
